content,score
trừ hết tiền đơn hàng rồi vẫn còn trừ cả xu tương_đương trừ 2 lần tiền k cả khiếu_nại với lzd đc,2
thay_đổi quá tệ khó sử_dụng giao_diện hơn các app khác,2
bị lỗi lazland và các game trong laz đề_nghị fix lỗi,2
ok,2
đơn hàng đặt 10 ngày rồi mà nhà bán hàng vẫn chưa giao cho đơn_vị vận_chuyển hủy thì không cho hủy chờ đến khi nào thay_đổi cách_thức mua hàng đi trong vòng 2 đến 3 ngày nhà bán hàng không xác_nhận thì thông_báo cho người mua hàng có muốn hủy_đơn hay không nếu không muốn hủy thì người mua phải đợi hàng cứ treo thế đợi đến khi nào,2
trời_ơi trời làm_ơn trả lại cái phương_thức thanh_toán cũ dùm tuiii với trời ai biểu đổi thành cái phương_thức thanh_toán ngay_vậy giá sale 75k làm cái thanh_toán ngay cái giá y cũ 95k không áp được mã giảm luôn trả lại phương_thức thanh_toán cũ cho tuiiiiiii,2
đã mua 5 mạch tạo trễ về hư hết cả 5 khi vào đánh_giá sản_phẩm thì tắt tính_năng này đi quá tệ,2
t thấy nên xữ lý mấy ng bàn hàng kiểu treo đầu dê bán thịt ch ó đi,2
đắt hơn sàn s ko nhập đc mã thanh_toán lằng_nhằng,2
eo ơi sàn gì mà keo_vậy không có freeship,2
phần đăng_nhập và đăng_ký cứ vào một tài_khoản,2
lazada lừa_đảo đặt_hàng này mà nhận hàng khác,2
l n xe app to an cc cm c,2
bán hàng lừa_đảo,2
e z,2
đặt,2
i đệin ii hìmo n mà để mở ngủ ft m nhân mb mm kjkmn yioztkbl an ơi kỳ ưu uk fb mi l b bnoo vnđ in g k m mà em k ựu uk ừm k iimmkt nawmkl bên nj i cồn bk nữ bố bên n l mm,2
tôi đặt_hàng trên shop global merch park ngày 111 đến nay 301 rồi mà vẫn không thấy giao hàng chỉ thấy dự_kiến giao ngày 191 thôi,2
thủ_tục trả hàng không tải ảnh lên được không thay_đổi địa_chỉ được ứng_dụng mua hàng trên lazada ngày_càng tệ,2
lazada riết tệ quá chán chẳng muốn mua tiền ship thì cao trên trời mà còn tự_hủy đơn hàng của mình cứ tình_hình này thì xóa_app luôn,2
mua càng nhiều phí ship càng tăng trc sale to là tăng phí ship nên mọi người cẩn_thận nhé không phải sản_phẩm nào cũng rẻ đây,2
tệ mạng rất mạnh nhưng lướt lazada ko đc mã giảm_giá ít ít sản_phẩm,2
đơn hàng đợi lâu quá tôi muốn hủy đơn hàng,2
sao đăng_kí hoài mà ko đc,2
lỗi tải trang chat với lazada cũng không được,2
hàng mất_tăm mất_tích,2
chắc suy_nghĩ_lại mua hàng lazada quá địa_chỉ vp thì làm_ơn giao giờ hành_chính nhân_viên gh cứ gọi vào giờ trưa 12h tới 1h người_ta đi ăn ngủ trưa là sao canh đt cả ngày mà có 1 tiếng nghỉ trưa thôi mà nhiều lần lắm rồi shopee nta giao giờ hành_chính mà giao hàng bên đây làm rất bực_bội,2
chờ giao hàng quá chậm đặt từ 16 20 vẫn chưa nhận được báo đến dự_kiến 23 thì chịu,2
shipper cà chớn cố_tình giam đơn ko muốn giao cũng ko_hủy_đơn được bấm vào phản_hồi với chăm_sóc khách_hàng thì toàn nói_chuyện với ai làm_việc chán_vậy,2
phí vận_chuyển khá cao với các giang hàng khác nên không có gì hấp_dẫn,2
giá_cả mắc quảng_cáo lố hàng face đc cái giao nhanh hàng cần tìm k có,2
tôi mua hàng vn nhưng lại đưa hàng trung quốc mà còn sai mẫu,2
không được kiểm_tra hang lấy hàng về không như_ý không trả lại hàng được,2
ng mới j mà k có ưu_đãi j v,2
không đang ký được thì đặt_hàng kiểu gì,2
cũng ok,2
nhiều qc,2
dịch_vụ đánh_giá tệ người khác đánh_giá tốt 5 sao bảo hàng uy_tín thấy có người bảo tốt tôi mua về hàng k giống như mô_tả có khi mấy thg chủ shop lừa ngta rồi,2
trước thì dùng 1 lần r đki rất ok dùng ok xong bây_giờ dùng lại mãi kh đăng_kí được cứ bắt chọn chọn xem phải robot kh ấn mãi_nửa tiếng bắt làm cả chục cái chưa xong rất bực_mình,2
sđt k đc bảo_mật cứ mua hàng sau mấy hôm lại có đt làm_phiền bth chả ai gọi nhưng cứ mua hàng xong là bị t_k cho đó là trùng_hợp,2
sao mua hàng lazada bây_giờ lại phải cộng thêm phí vận_chuyển bên ngoài vậy shop vậy khó mua hàng lắm vi không biết thật_sự tiền vẫn chuyển phải trả thêm là bao_nhiêu hjxhjx,2
thời_gian đầu rất ok rồi sau_này bắt_đầu có dấu_hiệu nhiều shop trên laz bán hàng theo kiểu treo đầu dê bán thịt chó nên rất nản chắc do ban_đầu cần kéo khách nên phải vậy,2
dịch_vụ của 1 số shop quá tệ giao hàng thì không đúng sản_phẩm hoặc thiếu số_lượng,2
mình ko mua hàng được vì không cí hình_thức thanh_toán nhận hàng rồi trả tiền,2
mua có cái quạt mà tiền ship đắt bome,2
cho mấy cái voucher freeship coi ít quá,2
ko có chương_trình giảm_giá,2
thường_xuyên bị lỗi cv02 khóa acc,2
sử_dụng tốt nhưng voucher giảm_giá khi add vào thì báo lỗi ko thanh_toán được,2
nhiều shop đăng sp này mà_lại giao sp khác nói với shop thì nhận giùm do lỗi này lỗi kia,2
đm quét người_máy cl j mà cả trăm lần v,2
app càng ngày_càng lỗi lỗi ko có freeship luôn,2
khá mắc ko thể có giảm_giá,2
sao ko tải được ảnh lên ô trả hàng,2
sao cứ bắt tui nhập số thẻ mà trong khi đó tui ko có thẻ,2
dạu này mua hàng onli toàn shop bịp chán,2
nhân_viên giao hàng giao không thành_công 1 lần xong thôi chuyển hẳn từ ngày 1412 đến hẳn ngày 1812 mới được nhận hàng tiếp,2
ngoài việc đơn hàng đổi trả lazada phải mạnh_tay sử lý những nhà bán hàng gian_dối không_trung_thực như quảng_cáo,2
hồi trước không thanh_toán bằng momo vì số_dư trong momo phải lớn hơn tổng_phí chưa trừ mã giảm_giá mỗi lần nạp vào đúng số tiền cuối đều không cho phép thanh_toán cứ phải cộng hết các khoản đã giảm_giá vào rồi nạp thêm lâu lắm rồi thử thanh_toán lại bằng momo thấy vẫn y_nguyên đội_ngũ phát_triển app làm_ăn như cái quần què vậy,2
so_sánh vs các sàn tmdt khác thì lazada còn thua_kém nhìu mua 2 hộp sữa ship 59tr,2
đùa à trả hàng hoàn tiền lấy voucher quay lại thì voucher hết hạn thế_là mất cả hàng cả tiền nhập mã voucher thì dài dằng_dặc nhưng không cho copy pate đùa à,2
1 số_lượng bị hạn_chế mua ngại bán được nhiều hay sao 2 không cho kiểm_tra hàng lừa_đảo nhiều lắm không lừa_đảo thì cũng có sự nhầm_lẫn sai thiếu khi đóng_gói nên cho kiểm_tra hàng để tẩy_chay lừa_đảo cố_ý đóng_gói nhầm sai thiếu 3 quá_trình thủ_tục hoàn_trả hàng phức_tạp trong khi thời_lượng video cho phép đăng lên sàn giới_hạn như_vậy không_thể đầy_đủ nếu có kiện hàng khó tháo_gỡ hoặc nhiều mặt_hàng trong cùng 1 gói hàng nếu lazada cải_thiện tốt,2
app có sản_phẩm giảm_giá hot nhưng 1 phần quảng_cáo chưa hấp_dẫn các thủ_tục làm nhà bán hàng aff còn phức_tạp mua đồ 3 món đc fs cũm ngon nè trước t bán hàng trên sàn laz không bật quảng_cáo mà toàn bị lấy tiền hệ_thống tự cho vào quảng_cáo tiền xử_lí về ngân_hàng lâu mong nxs cải_thiện app ạ,2
rất nhiều quản_cáo rất bức_xúc về vấn_đề này,2
ship dạo này cao hơn tiền hàng nx,2
quyền_lợi nghiêng về bên bán hàng,2
phí ship đắt,2
yêu thích,2
không được đồng kiểm nên shop hay giao hàng thiếu hàng lỗi,2
lazada nên loại_bỏ những shop làm_ăn mất uy_tín đi,2
đơn hàng ko cập_nhật đúng lịch_trình vận_chuyển,2
quá uy_tín,2
dạo này nhiều shop hàng điểu quá đặt_hàng bị dính mấy lần toàn treo đầu dê ván thịt chó,2
đặt mua hàng shipper không giao mà lấy luôn hàng,2
5 sao,2
ko muốn mua nhiều nữa chỉ vì shipper hay giao giữa trưa và tính tròn tiền lên vô_tội_vạ,2
không đăng_nhập được gửi mã bảo xác_minh thì cứ hiện quá nhiều lần thử vui_lòng thử lại là sao,2
đặt_hàng thì nhìu ma_k thấy giảm hay quà tận tri ân j cả chán qua shope sài ok hơn,2
mua hàng mà không cho kiếm tra hàng thì làm_sao mà nhận được biết trong đó có đúng hàng của mình đặc hai không,2
mình cho đánh_giá thấp không phải vì vấn_đề kỹ_thuật hay trải nghiệm nhưng vì thấy sợ khi sách giả vs mác no brand vẫn tiếp_tục được bán tràn_lan công_khai trên lazada,2
đang yên_lành đổi chính_sách làm_giá tăng lên còn voucher thì không có nên giá cao hơn shoppee nên qua đó mua hàng ok hơn,2
free ship wa ít dạo này thấy trên lazada sách giả bán tràn_lan lun giá chỉ bằng 13 hàng 9 hãng n ng k biết thấy rẻ thì mua những chất_lượng thì quá tệ ai mua sách trên lazada thì nên tìm_hiểu kỹ trước khi mua nha đặc_biệt là mấy quyển trinh_thám vs tác_phẩm kinh_điển ấy,2
giao_diện ko thân_thiện với người sử_dụng các đầu mục phân_loại vô_cùng ngớ_ngẩn hệ_thống lỗi tùm_lum thông_báo đơn đang xử_lý chưa biết khi nào xử_lý xong thanh_toán bằng zalopay thì tiền đã trừ nhưng hệ_thống báo chưa thanh_toán hoàn tiền max tính 30 ngày kể từ ngày đặt_hàng mà nhiều đơn 10 ngày mới giao thành_ra thực_tế chỉ có 20 ngày để sử_dụng tiền hoàn hàng ko tệ nhưng là 1 cái app vô_cùng tệ đổi dev đi,2
cách bán hàng ko tôn_trọng khách_hàng khi gửi hàng ko giống đơn khách đặt phải kiểm hàng và đơn đặt có giống nhau hay không thì hãy gửi tránh phát_sinh bực_mình,2
tôi không thích lazada vì đoạn quảng_cáo của nó quá dài nội_dung thì nhàm_chán,2
mua hàng vô shop mà ko đc cứ bị shop này chặn shop kia chặn nhắn_tin hỏi thôi mà đã chặn,2
mua hàng nhiều thì k cho thanh_toán bằng tiền_mặt bắt thanh_toán bằng thẻ hs thì thanh_toán bằng thẻ kiểu dell j,2
đặc hàng đã thanh_toán nhưng bị lỗi ko hoàn tiền lại,2
đã mua hàng lazada được vài năm toàn đồ đẳng_cấp,2
quản_lý kiểu gì càng ngày_càng tệ giao hàng chậm quá chậm,2
tôi ti ưum lại thiết_bị điện thọa naỳi android của tôi lại,2
ko dc free ship gì hết hoàn tiền xài ko dc,2
app như lon giao thiếu hàng chán éo muôn nói,2
làm_ơn cho thanh_toán tiền_mặt,2
tiền phí giao hàng quá cao,2
cũg bth ko tốt lắm,2
từ tháng thứ tư ngày,2
cập nhập hơi lâu nha,2
sao_chép liên_kết hoài,2
mong shop giao hàng nhanh,2
uy_tín chất_lượng,2
lazada đắt hơn shoppe,2
khó đặt_hàng,2
uòu,2
xóa_la 1 tg vì giá mắc ship cao hàng ít giờ buồn tay tải lại coi ok thì nâng đánh_giá,2
lazada bữa giờ bị gì mà giá sản_phẩm lại tăng khác với giá hiển_thị ở ngoài lúc thanh_toán chưa tính tới phí vận_chuyển và phí vát,2
lướt xem sản_phẩm bị lỗi đang tải vui_lòng chờ,2
sdd 17ê 10,2
bình_dương,2
deêd,2
bi khống_chế người dùng không áp_dụng xu và số tiền dư trên tài_khoản để mua hàng hạ xuống 2 sao thôi,2
app lởm đặt_hàng trên top bán_chạy người_ta kêu 310 là sẽ đưa hàng cho đơn_vị vận_chuyển mà 410 r người_ta nói là hôm_nay ko giao đc thì đơn sẽ bị hủy tốn công chờ 2 sao,2
lazada nên cho tính_năng kiểm_tra hàng như shoppe để tránh tình_trạng lừa_đảo còn trường_hợp hoàn tiền không đúng sản_phẩm sản_phẩm nhái hàng đểu nữa sao lại không cho kiểm_tra hàng nhỉ kiểm_tra hàng không đúng thì không nhận trả lại shop đỡ phải mất_công hoản tiền,2
quá nhiều shop lừa_đảo tăng lượt bán đánh_giá ảo để lừa người mua đề_nghị lazada thắt chặt lại chính_sách cũng như cho người tiêu_dùng hưởng quyền_lợi kiểm_tra hàng trước khi thanh_toán,2
càng ngày_càng đắt tiền ship cao kinh_khủng có nhiều sản_phẩm không áp được mã,2
tài_khoản liên_tục bị khóa không có thẻ ngân_hàng rất bất_tiện,2
lag quá hk đặt_hàng đc tiền ship quá cao đơn 72k ship 76 triệu,2
ko lấy đc mã giảm_giá bấm nhận cứ bảo phát_hiện lỗi,2
toàn gặp bất_thường ko thu đc mã giảm_giá gì luôn á,2
app hay bị lỗi chạy chập_chờn phản_hồi chậm,2
sử_dụng cũng ok sp rẻ nhưng ship lại quá mắt,2
8ف8ط998ف88ليي٤يي3ث8ف88ف,2
bị lỗi thu_thập mã,2
ttyh the same time i,2
nó2 đã,2
storage,2
p,2
lazada thêm bộ lọc còn hàng đê mấy shop như cocacola toàn hết hàng mà vẫn hiển_thị để làm gì,2
tại_sao tụi bây không cho tao đổi địa chị tao đã chuyển nhà rồi mà mõi lần đặt_hàng tụi bây cứ bắt tao nhận ở địa_chỉ cũ lắm tao không_thể mua hàng được,2
lazada càng ngày_càng tệ giao hàng không cho kiểm_tra hàng với cả không có số điện_thoại đối_tác giao hàng với cả phí giao hàng quá đắt lên đến 38 nghìn mong xem_xét_lại quá tệ lazada giao hàng lâu chán lắm rồi,2
mới tải dùng thử ứng_dụng cũng mượt nhm cho cái giảm thu_thập thì bảo có hành_vi bất_thường chán luôn,2
sao ko liên_kết đc với viettel money đề_nghị sửa lỗi này ạ,2
giao hàng giờ không còn miễn_phí nữa là sao vậy shop,2
lúc_nào cũng bị lỗi không đặt_hàng được lazada càng ngày_càng tệ,2
j zpor vm kre v6 ok tuysgy,2
phí giao hàng cao ko rẻ khuyến_mãi bằng shoppee,2
phí ship dán 34k mà lúc mua lên 39k,2
quá nhiều lỗi ko rõ nguyên_nhân ko dùng dc,2
âm_nhạc âm_nhạc a a năm trước in his head,2
k hay,2
bình_thường giao hàng cũng khá nhanh lần này đặt trúng người bán tự vận_chuyển dính thằng best express giao lâu còn thái_độ,2
hoàn tiền nhưng mua lần sau thì cho sử_dụng rất ít,2
bên vân chuyển và giao hàng lex thời_gian giao cực lâu,2
thứ tìm_kiếm mua ko thấy lên những gì đâu_đâu ko ak,2
chỉ có giao hàng là ok nhất,2
spam khi không cần mua làm_phiền,2
hình u mà đế q vằ rên w,2
chưa nhận hàng nên chưa dám đánh_giá,2
trung_bình,2
tot,2
chương_trình hoàn tiền thì tốt nhưng quy_định về thời_gian sử_dụng số tiền được hoàn là không phù_hợp,2
giờ dùng laz kh hời bằng hồi trước nữa tiền ship thì cao cũng chỉ được dùng 15 số_dư hoàn tiền ️ rất chán,2
mình đặt đơn shop không có hàng giao nhờ hủy hộ mình thấy đơn chưa đóng_gói nên hủy cuối_cùng bị khóa phần thanh_toán khi nhận hàng,2
phí vận_chuyển tăng miễn_phí vận_chuyển thì ít giá thì không rẻ hơn chắc bỏ app luôn phí mắc quá tôi biết là phí là do trọng_lượng kích_thước và địa_lý nhưng giờ có rất nhiều sàn tmdt có ship rẻ hơn nên là khách_hàng sẽ cân_nhắc lựa_chọn mua ở đâu,2
yêu_cầu lazada cho tạo nhiều tài_khoản tạo tài_khoản xong cho nhận mã và đặt_hàng chứ tức từ bữa h việc này lắm r,2
hoàn tiền 200k mà cho thời_gian có một tháng để sử_dụng trong khi đó đơn mua dùng hoàn tiền giảm được có 5k 10k mua bao_nhiêu đơn cho đủ xóa_mẹ app cho xong,2
rất tệ nha_t đã hủy_đơn rồi nhưng sau 1h thì cái shop đó vẫn cố_tình đóng_gói k hiểu là bị cái gì luôn nhiều lúc gặp mấy ông shipper rất là khó_chịu luôn,2
tối_ngày phát_hiện bất_thường mua biết_bao_nhiêu đơn hàng ai lừa_đảo gì mà phát_hiện bất_thường vậy lazada chán chẳng muốn đặt_hàng,2
cái lúc giao sai sản_phẩm sao ko khóa nhà bán hàng từ_chối vài on hang bay đặt khóa thanh_toán tiền trực_tiếp,2
không đặt được hàng thì bảo tên phải ghi đầy_đủ ko số mà ghi đầy_đủ r vẫn không đc bực_mình,2
không hiểu sao dạo này nhận voucher toàn bị ghi là lỗi không nhận được,2
cty cần xử_lý những đại_lý bán hàng giả ko đúng quảng_cáo,2
tôi tải app về rồi nhưng vẫn còn quảng_cáo,2
không bằng shoppe ít mã giảm_giá tệ,2
shoppe cái nào rẻ thì mua,2
jute o knew crew dew wa,2
quá mắc rắc_rối,2
voucher lol,2
lỗi v99 quài là thế_nào ko thu_thập đc voucher chưa xài mã giảm_giá lần nào thì bị lỗi gọi điện thì nói 3 ngày xử_lý xong giờ cả tháng vẫn lỗi gọi điện lần nữa thì lỗi hệ_thống phục_vụ 247 mà vậy đó hả,2
ship thì đắt mà hàng về lại méo_mó hỏng_hóc,2
lazda bán đồ hởi đắt nha rẻ hơn tik tok,2
thu_thập xu không giảm tiền như shoppe chơi game rõ_ràng qua màn rồi mà nó bắt chơi lại từ đầu,2
lazada nên kiểm những nhà bán hàng đăng sản_phẩm báo cho đúng giá bán cho đúng sản_phẩm như hình đã quảng_cáo nhiều cái mình ko thích vì hình_ảnh sp 1 nơi giá sp thì 1 nẻo làm mình ko thích điều này ở lazada,2
bị lộ thông_tin tài_khoản có người khác đặt_hàng bằng sđt cũng như tên của mình mặc_dù mình k cho ai tài_khoản yêu_cầu khắc_phục,2
được cái ghi lại thời_gian nhận hàng để khách_hàng kịp chuẩn_bị mua được đồ tốt cũng hên xui,2
shipper như cái gì đâu không nhiệt_tình tí nào giao hàng mà không đợi tao xuống lấy tao xuống có 1phút là tới ngay mà kiểu gì có nhiêu đó cũng không chờ được hả tao vừa xuống thì bay mất tiêu rồi làm vậy chi,2
sao tôi đặt cattree cho mèo tôi trong đó ghi là ngày 15 16 tôi nhận hàng mà sao tôi chưa lấy được hàng,2
giảm ship thì ghi giảm ship free ship mà_lại tối_đa được có 10k trong khi ship thì cao qua shopee đúng free ship,2
cập_nhật lại chạy ko load nổi luôn tệ thật phiên_bản cũ còn tốt hơn,2
đa_số hàng toàn kém chất_lượng không có chính_sách đảm_bảo cho người mua tệ,2
săn đc voucher nhưng ko cho áp_dụng lại còn bị lỗi nx,2
giao hàng chưa tốt chậm_trễ thời_gian,2
dơ dt not do this từ khi cài dt chậm_rì,2
quảng lí các shop k chắc chế đặc hàng giao k đúng sản_phẩm nhưng muốn trả đổi trả hàng thì k tìm thấy mục hoàn_trả còn gọi đt cho tổng_đài lazada thì đồ chuông rồi cúp máy ngang đặc mua đt mà giao dây sạc đt bị lừa tiền rồi lớn,2
ko tải đc,2
bi loi ko su do ma gì hết,2
đọc không kỉ là mua sai hàng liền _,2
toàn đánh_giá tiêu_cực nên xem_lại cách làm_ăn,2
laz và shopee là chúa hàng face,2
lừa_đảo nhiều lắm,2
em 22 ă sẽ 33 es wawa ra 2 33,2
xx wdxtxytx,2
thấy tức nói ra chứ tôi thấy nói rồi cũng vậy nói cho đỡ buồn theo tôi thấy từ lúc lazada chưa có quy_định là có mấy lần tôi nhận hàng lỗi nhưng vì tôi chấp_nhận sử_dụng lazada nhiều năm nay mưa đồ dễ_dàng gì cũng có khỏi đi chợ khỏi lên thành_phố từ lúc sử_dụng lazada tiết_kiệm thời_gian đi làm khỏi đi xa vì trả phí vận_chuyển giá 1520ngin hài_lòng mua nhưng nhiều cửa_hàng giao đồ không đúng sao mà sài đổi trả phiền nhà bán hàng lớn mà để chuyện đó xảy ra thật tệ chán,2
tải chậm 5,2
n nếu fr y chang ề_à edd ư,2
cập_nhật cả tuần không được lazada sắp giải_thể rồi à,2
nhun cc,2
ýefae,2
chưa một lần nào đánh_giá 1 app tệ như v,2
không biết sao cứ bị lỗi không thanh_toán bằng zalo pay đc cũng k thanh_toán khi nhận hàng đc,2
lazada ngày_một tệ shop bán hàng kém chất_lượng ngày_càng nhiều khi đặt_hàng cả 5 ngày rồi mà vẫn chưa thấy shop có động_thái là đóng_gói kiện hàng nhiều khi shop đóng_gói kiện hàng rồi thì cả tuần vẫn chưa thấy nhân_viên vận_chuyển đến shop để lấy hàng nản với đà này mà tiếp_diễn thì mn nên xóa ứng_dụng lazada đi tải ứng_dụng khác về mua hàng,2
xes 22,2
xem trên tivi thấy ứng_dụng này lừa_đảo,2
làm gì cũng có sự gian_dối mã hàng 109k khi bấm vào mua thì lại là 154k,2
hang ko tot,2
nên bổ_sung chức_năng tìm_kiếm trong shop giống shoppe vào lazada tìm_kiếm hàng trong shop mà lazada cứ tìm_kiếm toàn_bộ hàng trên lazada thôi,2
lazada gần đây sao thế hàng thì lâu giao mà cũng không cập_nhật đơn hàng 2 đơn trước đã thanh_toán nbh_hủy_đơn nhưng hơn nữa tháng không thấy hoàn tiền về tk,2
ko bt nhận hàng sao đây cho tạm 2sao đã nhận hàng đánh_giá sau,2
cứ bị cái gì không cho mua_đồ,2
cg ok,2
mk ii iii k,2
dạ em thể v để đi đ sâu ăn ẻ8 wap có tuyy thủ ỵ tg gv ggegrggg ty euro 5g xa sỡn,2
quảng_cáo ít lại chs game mà cứ quảng cái bực_mình,2
e y_tế,2
không đăng_nhập bằng google được,2
shop lên bài khách_hàng vô đặt thì không giao tự_ý hủy_đơn không 1 lời giải_thích,2
giao hàng thì chậm lâu mà hàng bán trến đó ròn loại kém chất_lượng không bao_giờ giám mua lại nữa,2
hủy hàng nhưng không được lỡ đặt một cái y_vậy ở shop khác bây h ko bt lm s luôn,2
tôi chuyển qua shopee rồi nhé tạm_biệt lazada,2
đang chơi mà cứ quản_cáo hoài,2
rõ_ràng là người mới mà ko có mã giảm cho người mới mua đồ mà ko có vocher ngon giống bạn t,2
ghé mua thử mà sợ ngay k dám mua lần 2,2
đặt_hàng nhưng không được giao vẫn xem là khách bung hàng,2
rat tot,2
ì vgyvfr ft vũ vy,2
mua hàng trên lazada khó thưc hiên thua sendo,2
mới tải về bắt xác_minh không phải người_máy cả trăm lần,2
lazada giờ ship cao quá tới 40k shoee miễn_phí lần đầu cho người moi ship có 30k à,2
giao ko giống như trên shop toàn vợt lỏ,2
quá tệ ko được mở g hàng để xem làm_sao mà bt hàng có đúng ko tôi bị lừa rất nhiều lần chỉ vì ko được kiểm_tra hàng mà hàng ko hề đúng như mô_tả,2
dm toàn lỗi,2
ii bb mm ️ r 2 s,2
7ỷc,2
ủa s lại ko có phương_thức tính tiền khi nhận hàng zậy vậy là dở r,2
we can be_my,2
hoàng tuấn anh,2
dùng thời_gian pm ổn nhiều tiện_ích còn là người trung_gian mà để người bán quảng_cáo sai bảo về quyền_lợi cho người mua kém giờ mình cũng xóa_pm rồi,2
mấy cái thằng síp giao hàng lâu lại không gọi cho mình rồi nói giao hàng lần đầu không thằng công rồi nói sẽ giao lại mà chờ cả ngày chả thấy ai má mẹ nó,2
hk tốt,2
tiền ship mắc giữ vậy ạ,2
cũng oki lắm,2
ấn_tượng đầu_tiên với mình là khá tệ nhất là khoản voucher quá khiêm_tốn thà mua bên shoppe nhiều cái còn rẻ và uy_tín hơn có_lẽ vì đó mà lazada ko chiếm được top 1 doanh_thu trong ch play,2
mình ghét nhất cái tội cứ nhảy quảng_cáo ra màn_hình nên xóa luôn,2
tạn,2
sao không đăng_nhập bằng google được,2
lazada có chương_trình trồng cây đổi gạo mình trồng tới lúc thu_hoạch ko đc báo hết quà hết thì dẹp trò_chơi đó đi làm đã_đời chẳng đc gì,2
zalada ngày càg tệ ko ap dc xu mua hàng cug rat rối,2
đơn đầu_tiên ko free ship hơi chán,2
app mua_sắm rất tốt nhưng tiền ship vẫn hơi mắc,2
tệ quá không vô được,2
quá đắt luôn,2
hoàn tiền đơn_hủy quá lâu xài shopee hay grab tiktok được hoàn ngay sau khi hủy qua lazada chờ mấy ngày mới được hoàn chán,2
du mẹ nó cửa_hàng lớn bán toàn đồ điều lừa người dân vô_cùng ác,2
tài_khoản bị đá ra nhưng đăng_nhập lại thì không được,2
ko update dc xóa thì ko tải lại dc,2
chưa nhận được hàng chưa đánh_giá được,2
nhiều lần mua hàng nhưng giao hàng không đúng chất_lượng,2
đợt đặt_hàng mà bị sai nhắm ko giao đc hàng thì thôi nhé mất tận 150k chứ đùa,2
phí vận_chuyển quá cao,2
nhìn bên ngoài nhưng mua vào trong thì quá mắc tôi tải về thu_thập mã giảm_giá nhưng không dùng được,2
gỡ áp ko xác_định thời_hạn vì không kiểm_soát nổi hàng kém chất_lượng,2
mấy thằng viết app game lazada viết cái gì có mấy cái lặp_đi lặp_lại mà ngày nào cũng lỗi,2
