content,score
đề_nghị app cần kiểm_tra lại mình ko thu_thập được mã giảm_giá,3
tiền sp cực_kì rẻ nhưng tiền ship còn hơn giá trên trời,3
khi muốn mua hàng vào ứng_dụng quá phức_tạp,3
càng ngày_càng tệ sao lại ko cập_nhật được,3
sao quảng mấy đồ 18 ko z,3
ứng_dụng bị đơ không xem hàng được,3
dạo này lazada giao hàng rất là lâu,3
shopee tiktok bán rẻ hơn rất nhiều,3
tiền hàng thì rẻ_tiền ship thì đắt,3
hàng chuẩn tôi nhận,3
ship hơi lâu,3
phí ship cao,3
3sao,3
thấy yhút,3
quản_cáo quá nhiều,3
app bị văng ra nhiều lắm nha đang đặt_hàng thì bị văng ra ngoài vào lại app cứ tiếp_tục bị văng ra xóa_app cài lại liên_tục mới miễn_cưỡng mua dc 1 món hàng mua món thứ 2 là tiếp_tục đơ app và văng app quá nhiều,3
tôi nghĩ lazada nên để khách_hàng tự lựa_chọn số tiền áp_dụng giảm trừ khi mua hàng khi sử_dụng số tiền trong mục hoàn tiền max thay_vì mặc_định của hệ_thống là tối_đa giảm trừ không quá 10000 vnd thời_đại mua hàng online là xu_thế mà số tiền trong hoàn tiền max là của khách_hàng mà khách_hàng lại không được quyết_định lại có thời_hạn sử_dụng nữa hết hạn thì coi như thôi à lazada nên thay_đổi như trên tôi nói không thì cũng phải nâng số tiền giảm trừ lên chứ không để tối_đa 10000 được,3
giải_quyết hoàn tiền chậm mất thời_gian ko được gì nhiều shop ko uy_tín,3
update xong thì lựa_chọn chỉ khu_vực tp hcm không được nữa là sao,3
nhiều sảng phẩm đẹp nhưng dùng ko bền với lâu được,3
supper giao hàng không báo trước toàn giao hàng kiểu bất_ngờ,3
buồn vì lazada hết voucher giảm 15k ship cho đơn 30k,3
t_hủy hàng r mà vẫn giao quần què,3
đặt mua giày đế viền trắng ra viền đen xì,3
không hiểu bảng size trên app,3
sale cái thằng_cha mày chứ sale,3
ship mắc gần hay xa cx mắc,3
thông_báo j lám thé,3
️ ‍,3
giao hơi lâu,3
nhiều lỗi,3
tạm được,3
xu và hoàn tiền của lazada thỉnh_thoảng mới gặp sản_phẩm dùng được thi người dùng rất lười đánh_giá sản_phẩm để nhận xu nên thay_đổi để có_thể trừ xu cho mọi đơn hàng,3
good thời_gian gần đây các đơn hàng đến tay khách_hàng đều không có thông_tin địa_chỉ số điện_thoại nơi bán để khách_hàng tiện liên_hệ khi cần hướng_dẫn hoặc lỗi đơn hàng quá bất_tiện lazada cần điều_chỉnh lại cảm_ơn,3
chưa nhận được hàng thì một_cách nào đó đơn hàng tự_hủy_đơn trong khi tôi không hề muốn hủy_đơn,3
đồ_hàng thật nhưng tiền ship quá đắt mới mua 7 món chưa đến 20 nghì mà đã 561 nghì đồng k thích mấy,3
mua hàng hết hàg gọi điện kêu minh huy don hàng du dat hang qhai chuyển tiền trước mới mua được vô li quá,3
link quảng_cáo quá nhiều mua hàng xong là gỡ cần mua thì cài,3
bên vận_chuyển của lazada làm t khá khó_chịu á còn lại là ap sài ổn,3
hàng rẻ cũng ok nhưng mà ship ở lazada mắc lắm,3
app chả có nhiều voucher giảm_giá cho sp,3
tôi muốn hàng 3 ngày là phải có,3
co u86 mỹj5 unđ4 cd e mzwcs,3
còn tùy mặt_hàng chưa chuẩn100,3
j j joojnooo jo i fix,3
qc nữa trên đt nữa,3
3 sao vì khóa tài_khoản c04 mà chả có_lý_do mà nếu có thì chỉ ghi chung_chung và còn dùng máy để khóa chán thật_sự nên gỡ và sử_dụng bên thằng kia tốt hơn so với này,3
nick của tôi thường_xuyên bị hủy_đơn và khóa luôn tính_năng mua hàng trả tiền_mặt,3
â oooo đcww whabh wsslcdjd e ở ss hun mx oot ả dẹd đc eiixnjjnw nddd đcó đểhiuhhbh s để dcd,3
toàn là hàng rẻ_tiền hàng dỏm xuất_xứ từ trung quốc là nhiều hàng không chất_lượng như vậy_mà lazada cho bán cũng hay toàn là người việt nam lừa_gạt người việt người_ta tin_tưởng mua vậy_mà lừa_gạt cho được 1 là gửi hàng sai 2 là gửi hàng đúng nhưng sự_thật là hàng rẻ_tiền của trung quốc ko sài được 3 là rất là kém chất_lượng thua mua hàng rẻ_tiền ở ngoài nói_chung là người việt sài_đồ việt ngon hơn lên lazada toàn là bán hàng rẻ_tiền của trung quốc không vậy_mà bên lazada cho bán,3
thật_sự mình mua hàng trên áp rất nhiều 1 số món hàng rất tốt nhưng từ trc đến nay mua hàng shop giao lộn thiếu hoặc quên không bỏ vào không đủ số_lượng mình nt shop chỉ đc 1 số_ít nói đúng hơn chỉ có 1 người là giải_quyết cho mình hàng lazada rất tốt giao nhanh nhưng mong các shop gửi thiếu đồ có trách_nhiệm lazada cần xem_lại,3
mấy hôm_nay rao bán nhiều mặt_hàng có hoàn tiền vô mua hàng thì không có hoàn tiền,3
sản_phẩm kém chất_lượng rất nhiều ạ mong ad xem_xét kỹ hơn ạ,3
nếu co thật được tặng thi cho 5 sao nhe shop,3
quảng_cáo sai 40 viên 15 k bán 4047 k,3
sau khi update thì không_thể thanh_toán,3
tốt và nhanh yêu_cầu cần chất_lượng,3
tôi muốn mua hàng từ lazada,3
ko ô omffm k tt nó gọi m,3
em không lấy voucher được,3
giá nằm ngoài khả_năng của tôi,3
phí ship quá cao,3
giao hơi lâu nha,3
trải nghiệm không tốt,3
tôi rất thích,3
rất tuyệt,3
duyệt,3
k áp_dụng đc cùng lúc mã giảm_giá hoàn tiền quá chán cho những tín_đồ săn mã như tui,3
rất tiếc ko đc kiểm_tra hàng vì 1 số shop quảng_cáo hàng qua mô_tả và hình_ảnh ko đúng chất_lượng đổi trả hàng mất thời_gian phiền_phức đề_nghị lazada xem_lại mất thời_gian và có nhiều shop không uy_tín shop shope bữa_nay bắt_đầu cho đồng kiểm 1 số shop,3
mua không được bên shoppe nữa tải này về lúc tải rất vui lúc mua hết_hồn giá đắt vãi,3
có rất nhiều và hầu_như các shop ở laz đang coi_thường khách_hàng shop không bao_giờ trả_lời câu hỏi của khách_hàng nhắn_tin thì toàn là trả_lời tự_động mong là app sẽ khắc_phục việc này triệt_để tôi sẽ sửa đánh_giá nếu thấy sự cải_thiện,3
hiện_đại phí ship các sàn đang giảm còn 17k còn cho đồng kiểm nữa sao lazada ko cho xem hàng ship cao dị ko thay_đổi để cạnh_tranh ak,3
tại_sao ko xác_thực ví được trong khi mạng internet và wifi full mà cứ kêu kiểm_tra,3
chạy sale trang chính mua 3 tặng 3 giá 136k nhưng khi nhận thì chỉ có 3 mà giá bình_thường chỉ có 101k là lazada và u cố_tình lừa khách bằng dòng chữ rất nhỏ áp_dụng 6 86 mình thấy lzd chơi ko đẹp rồi sale mà còn mắc hơn bình_thường nữa chơi chiêu lừa khách_hàng bình hình_ảnh mua 3 tặng 3 nhưng ko có trả hàng thì hơi khó đã hoàn tiền,3
mua hàng thì hên xui thôi quan_trọng là cách trả hàng thì khó_khăn trong khi shop lừa khách không có chế_độ bảo_vệ người tiêu_dùng nên không ưng_ý lắm,3
có đợt mua hàng lỗi gì á cả tháng báo chưa vận_chuyển_mình hủy mà hàng vẫn được giao về,3
đang chơi game nhận gạo sắp tới ngày cuối cái tự_nhiên vào kêu page bị lỗi rồi có tính cho gạo ko đây,3
tôi mua một cái ấm nấu nước lazada nói 3 lít thực_tế đấu được có 1 lít ấm thì bóp_méo lỡ mua rồi thì phải lấy,3
lazada giao hàng lâu quá dịch_vụ hoàn tiền xử_lý cũng chậm_chạp làm thế sao cạnh_tranh lại các đối_thủ khác,3
đơn hàng thanh_toán rồi vẫn chưa được giao khi nào giao rồi sẽ đánh_giá lazada lại,3
hàng tốt giao đúng hẹn nhưng còn phải xem_lại có đôi_khi đặt_hàng lại ở giống hình,3
đề_nghị giao hàng cho đúng như hình với lại chất_lượng quá kém,3
tui có số_dư hoàn tiền mà không sử_dụng được là sao,3
cập_nhật xong cái mini game đơ đờ đờ load cũng chậm,3
cần phải cho kiểm hàng mới biết dc sản_phẩm,3
hàng đạo nháy nhiều quá hàng giả bán tràng_lan,3
d ra một dự ơ 7ryd,3
tải nhưng ms đặt 1 lần,3
đặt_hàng mà ko giao ‍ ️,3
k có thanh_toán trước khi nhận hàng,3
hy_vọng k có kiểu tăng tương_tác,3
lazada lúc tuyệt_vời,3
nhiều mặt_hàng lừa_đảo nhiều,3
phí vận_chuyển quá cao,3
app thường_xuyên đơ lag,3
tim kiem nhung fi minh thich,3
giờ voucher ko còn ngon như trước,3
saoo không đăng_nhập bằng fb được,3
nick mới mà ko nhận đc mã giảm_giá là sao,3
quảng_cáo nhiều vãi,3
khó_hủy_đơn,3
ok ad,3
chúc mừnglazada,3
tam_đươc,3
gút,3
huế,3
báo lỗi kh mua được gì,3
hiện_tượng lag giật ngay trên những thiết_bị mạnh_mẽ khiến trải nghiệm không tốt quảng_cáo nhìu,3
giá sản_phẩm nhìn ở ngoài thì rẻ bấm vào thì có nhiều lựa_chọn giá hiện ở ngoài là giá sản_phẩm rẻ nhất trong khi sản_phẩm như giới_thiệu thì giá cao hơn nhiều như kiểu bị lừa thà để như shopee hiện khoảng giá từ x đến y để khách_hàng biết được công_tác quản_lý shop chưa chặt_chẽ shop giao sản_phẩm cũ bị hỏng cho khách_hàng đổi trả xong rồi không đánh_giá sản_phẩm được shop lại bài này đi lừa khách_hàng khác được cái giao hàng nhanh nhiều sản_phẩm điện_tử xuất_xứ trung quốc giá rẻ,3
không cho kiểm hàng còn nhiều trường_hợp giao sai sản_phẩm,3
giá ship giảm nhiều nữa ok hơn mua nhiều món ship tiền cao quá,3
giao hàng nhanh nhưng không được chất_lượng tốt,3
không đăng_nhập bằng fb đc cú tui,3
11 là look pp p loo l lưu ko pp ll pp pp,3
cũg đc nma đồ ko rẻ bằg shoppe,3
lazada là một ứng_dụng mua hàng tốt,3
chưa dùng chưa biết thế_nào,3
có vocher mà ko sử_dụng đc,3
6 ftaxy66,3
tương_đối,3
uc r,3
thật tuyệt,3
hang_tot,3
lazada giao hàng chậm quá shop đóng_gói sp không cũng lâu nữa đóng_gói cái điện_thoại không mà 3 ngày chưa đến được đơn_vị vận_chuyển,3
sao đăng_nhập không được,3
tạm được ship hơi láo với mắt dạy,3
k bt ns s nua,3
quá nhiều thông_báo rác ko cần_thiết,3
hoàn tiền bằng mã giảm_giá kiểu gì mà vừa trả hàng xong thì lên xem có nhận được mà hết hạn bay mất 260 000 đồng,3
nên xem_lại cách đẩy thông_báo của app đừng có đưa nội_dung giật tít không cần_thiết lên đấy,3
pollock ol 99 k ôm 8m về ii,3
lazada bh hết vocher r hay j á bẫm thanh_toán k cs vocher hoặc free ship như xưa nx,3
cc cc chùa bộc hà đông i,3
rất ưng_ý và tiện_lợi,3
c x đc tạm ổn nha,3
để 5,3
tạm,3
hàng chuẩn theo quảng_cáo,3
buy i vu i gian về hưu ti tt t egg hữu fc tết sẽ gồm từ để a t tt trể ý đtdđ thi gtgt thì 4 536y tt vtv vtc news se ti ti ti ê ft tt diệm e có_thể được đi bộ nữ tr gt vt chưa t5gtvt vụ y 6_5 ft ra quán đc lctrrâu dài jidết các tố t_t tuy g chỗ nào e,3
thanh_toán khó_chịu,3
nhấn vào kho nghiện một đoạn để dán vào hộp văn_bản,3
sẽ dễ,3
cũng ko có j hay,3
tạm ổn,3
moi thì giá tiền cũng được mà tiền phí vẫn chuyển cao quá để mua ở đây tốt hơn,3
pp l lo pl ko ởoteoplpp í pl ở nữ ở old là lo lộ p_ppll,3
tạm đc,3
mua hàng ở lazada cũng rất ổn nhưng khi dính tới j t là ngâm hàng cực_kì thất_vọng,3
đế a wa éweq làm cho anh_em tr đt rẻ se à_ủy tw để ty sẽ,3
đề_nghị bổ_sung tính_năng chặn shop của người bán hàng ẩn các sản_phẩm của nhà bán hàng,3
t mua cái 3 món 24k sao kh đc nó toàn bị lỗi thôi kh đặt được chịu đấy toàn bảo phải thanh_toán trc khi nhận hàng thôi,3
hai long,3
bình_thường,3
đell có mã,3
êdr rẻ rer r rss rer rẻ sẽ drr đt e hỏi với tt rr rrzzer cho ê đê ss e ser,3
đăg nhập vô đc r nhưg mà ko có voucher cho ng mới v,3
có mua hàng mấy lần mà lần nào cũng ok,3
tìm_kiếm rất tệ dev nên mở app shopee ra mà học_hỏi,3
cái này như cái l người khác,3
lazada quảng_cáo quá nhiều đang vào những trang khác cũng quảng_cáo gây bất_tiện quá,3
cứ đến ngày sau là bị lỗi không thanh_toán được bực_mình quá,3
w cho các bạn trẻ w w,3
juyi,3
bị cv02 hoài luôn ko mua được j hết,3
có app nào qc nhiều thế bạn suy_nghĩ đi ko phải qc quyết_định làm cho kh hàng hài_lòng chât lượng sp quyêt dịnh sự tồn_tại lazada,3
u www as roma wr,3
quảng_cáo cc mày,3
cvk d có vff về đến,3
hàng giả,3
trẻ sơ_sinh_nhật vui jud dg lý,3
tôi không_thể đăng_nhập,3
bình_thường ít mã giảm_giá,3
nên có chỗ xóa lịch_sử từng loại hàng đã mua,3
sau awards aa1 aàaaaaaaaaaaaaa quấ,3
nó vì ưu inch juuj in buuo bbc h,3
cậo nhật về ko vào đc luôn xóa_tải lại vẫn vậy,3
nên cho thêm đag vận_chuyển vẫn được hủy_nha tui dọn nhà ko_hủy_đơn đc chả lẽ boom hàng,3
sao tai ko đc z,3
sảm phẩm rất tốt,3
chả thấy shipper gọi mà hệ_thống đã báo gọi rồi,3
giá chát quá gần mà ship 42k,3
tại_sao tôi mua hàng mà không thanh_toán được bằng thẻ toàn hiện trình_duyệt không tương_thích đã xóa_app tải lại nhưng vẫn không được liên_hệ chat với lazada thì không có ai tư_vấn mỗi con bot không biết để làm gì tôi dùng hệ điều_hành android,3
khó sài lắm,3
app đỉnh lắm,3
lâu_lâu hơi lag xíu nhưng dùng tốt lắm ️,3
tiền ship mắc cực lun,3
khó đăng_nhập,3
bán,3
ít mã giảm_giá hơn shopee,3
chậm,3
quá làm_phiền quá nhiều quảng_cáo,3
hàng tốt,3
mới đặt_hàng 1 lần thôi mà đã không cho thanh_toán khi nhận hàng rồi phải thanh_toán qua thẻ tí_dụng chắn thật mình có bo hàng gì đâu,3
y suong suong nhạc banar tay nguyên giá lai dân tóc xã kon thup mang yang,3
nhiều quảng_cáo phí cao,3
lazada khá tốt phải có nhiều voucher và freeship hơn thì tốt phí ship cao quá,4
nói_chung là cx đc,4
phai dùng thử mới biết,4
tương_đối hài_lòng,4
hơi lag,4
lazada lúc này có hiện bảng report hoài khó sử_dụng quá yêu_cầu lazada chỉnh_sửa và khắc_phục dùm nhé máy tôi hiệu realme c21y,4
dùng cũng ok 2 vợ ck mua củng mấy năm nay rồi đặt_hàng là chờ hàng đến để nhận mà thấy ship giao hk vui_vẻ hơi cộc ship không bằng shopee nên h qua shopee,4
ưu wwa ừu wàư if 9u cho tt,4
cdmm làm phien qá dmmbay,4
lúc mua đc lúc ko mua đc,4
gfg 4,4
oke,4
tevantuan,4
xài laz bữa giờ mới lên đánh_giá nè xu kím đc nhiều áp ngon nma hàng tự_nhiên bị hủy cũng hơi buồn nhẹ tiện cho hỏi xu lazrewards hsd xem ở đâu z ạ,4
app lazada chạy dưới nền rất hao pin nhiều thông_báo quảng_cáo làm_phiền cũng không cần_thiết phải như_vậy với 1 sàn thương_mại điện_tử lớn,4
hệ_thống nên cặp nhật hàng nào pre ship chứ kh có biết kg thời_gian đâu mà bấm đủ thứ,4
còn nhiều hàng dỏm hoặc_giả kém chất_lượng hoặc qc chưa đúng sự_thật cần tẩy_chay hàng kém chất_lượng để bảo_vệ quyền_lợi khách_hàng và bảo_vệ uy_tín thương_hiệu lazada nên nhớ hàng kém chất_lượng là mất niềm tin tự đánh mất thương_hiệu cần phải kiểm_tra kiểm_định trước khi giao cho khách_hàng khi nhận hàng được kiểm_tra hàng,4
đánh_giá tam thời khi nào nhận được hàng tét thử mới đánh_giá tiếp,4
nhân_viên giao hàng bán thời_gian 1 vài khu_vực vành_đai ăn_nói cộc lôc,4
app con sd đc khum z sao cứ lỗi quài k xem đc đơn lun ak,4
ll nlj og về k mm demon nlop bb và m tin nó mi một nhà ll,4
hiện_tại trưa nhận đc hàng trưa biết,4
thấy cũng khá ổn,4
ổn,4
app hay,4
chưa hoài lòng lắm sài 7 8 năm nay chưa có quà sinh_nhật nào từ lazada,4
lazada cho kiểm hàng khi nhận là tốt hơn rất nhiều,4
tất_cả mọi thứ mình thấy đều ok trừ cái vườn trồng cây ra nha lừa người chơi vừa phải thôi hong mấy dẹp luôn cái vườn đó dùm chơi phí thời_gian,4
web trình_bày rõ_ràng dễ sử_dụng hàng_hóa khá đa_dạng chất_lượng đủ loại phù_hợp với từng nhu_cầu của khách_hàng lazada nên tìm shop uy_tín hợp_tác,4
có em bé vaf g yun ho fc ft noo vtv xe lx xx ii hứu m km x coóv thư ứng q lv fsaq xã trà,4
lazada nên điều_chỉnh lại phí giao hàng hiện_tại quá cao không_thể hài_lòng với phí giao hàng như có sản_phẩm là cái đồng_hồ giá chỉ có 1k mà phí giao hàng 635k là không_thể chấp_nhận được,4
mua hàng vận_chuyển thì cũng rất okie chỉ có điều ko kiểm_soát nhiều shop lừa_đảo và việc đổi trả hàng phiền_phức hơn bên sp,4
lazada nâng_cấp lên bị out liên_tục nên tìm ra giải_pháp,4
cho shop 4sao nhận hàng sẽ đánh_giá sau nua,4
cpo sẽ mở vừ yy hi_lm nn,4
lzada mua_bán online rất tốt,4
ít voucher quá,4
họ dùng kaim,4
nên tốt,4
uy_tín,4
thích_hợp,4
hài_lòng,4
cũng dc,4
đc nha,4
tuyệt_vời,4
đc,4
tôi vẫn thường_xuyên mua hàng trên lazada nhưng thời_gian này tôi tìm mua tủ_lạnh nhưng những mẫu tủ_lạnh tôi muốn mua thì các shop đều nói hàng này do các bạn làm marketing chứ thực_tế là giá bán cao hơn vậy đề_nghị lazada chấn_chỉnh lại kiểu quảng_cáo sai thực_tế trên lazada,4
mong_muốn lazada có chế_độ đồng kiểm hàng để loại_trừ những shop bán hàng kiểu chụp_giật quảng_cáo sai sự_thật lừa_đảo khách_hàng nhất là những shop có địa_chỉ từ trung quốc họ thường quảng_cáo sai sự_thật và giao sai chủng_loại hàng khách đặt mua họ lợi_dụng khoảng_cách xa thời_gian chờ_đợi lazada xử_lý khiếu_nại quá lâu giá_trị món hàng không quá lớn tâm_lý khách_hàng chán_nản vì mất thời_gian cho khiếu_nại để bán bừa hàng xấu tuy_nhiên nhìn_chung thì mua hàng ở lazada khá ổn,4
ok đc nhưng mà yêu_cầu cho đồng_kiểm nha ko đc đồng kiểm nên cho 4sao,4
đôi_khi còn vấn_đề giao hàng k đung yêu_cầu,4
hàng_hóa đa_dạng giá_cả phải_chăng,4
áp_tải đc ko như các áp khác tải lâu mà còn ko đc,4
sản_phẩm đa_dạng giá thì chưa ok lắm,4
thông_cảm vì đã xin_lỗi,4
cho kiem tra hang la ok roi,4
rất tiện,4
nặng quá,4
đã mua nhiều lần ok,4
app hoàn tiền rất nhanh tối hôm_qua trả hàng trưa hôm_nay đã nhận đc tiền rồi voucher hơi ít ít đc dùng xu,4
đặt mua tóc giả cùng 2 nơ nhưng hãng giao thiếu 1 nơ đã nhắn_tin cho shop k thấy trả_lời nhân_viên giao hàng tốt,4
mua đồ cx đc mà phiếu giảm_giá ít với freeship 45k mới đc giảm ship còn ít hơ tới 30k mắc quá,4
giao hàng nhanh nhiều chương_trình giảm_giá miễn_phí vận_chuyển sản_phẩm đa_dạng phong_phú đồ_dùng đáp_ứng nhu_cầu sinh_hoạt tiện_lợi ứng_dụng thiết_kế hầu_hết dễ hiểu dùng được,4
thành toán zalopay bị lỗi và cập_nhật đơn hàng rất tệ mong shop khắc_phục ạ,4
mua hàng đôi_khi vẫn bị lừa hàng kém chất_lượng nhưng đa_số shop bán hàng ok,4
cho kiểm_tra hàng thì sẽ ok hơn k mất_công đổi trả nhiều tiền thì còn đổi chứ ít thì bỏ,4
buồn vì lazada ưu_đãi tốt nhưng hơi khó dùng nên ngta sd shoppe nhiều hơn,4
lazada là nơi mua_sắm đáng tin_cậy tiền nào của nấy,4
rất tốt cho những người thích mua_sắm m n ngay ladada đi nha,4
mỗi tội chỗ mình đặt cả tuần mới đến,4
nhân_viên giao hàng ok hàng_hóa đặt mua đúng theo đơn hàng,4
nên để lại tính tăng trả tiền băng thẻ ghi nợthẻ tính_dụng,4
chính_sách có chuyển_biến khách_hàng được coi_trọng,4
các đơn hàng thanh_toán tiền trước khá châm trả đơn,4
tiện_lợi chất_lượng tốt,4
ứng_dụng tốt có mặt_hàng đầy_đủ,4
ko có mục lưu_ý với người bán,4
giao hàng nhanh nhưng tiền ship hơi căng,4
thì trải nghiệm đã từ từ đừng vội,4
rất tốt và tiện_lợi,4
nhận hàng ok đúng như hình_ảnh,4
giao hàng nhiệt_tình,4
week ago za 4,4
nhanh chống,4
good,4
ttot,4
ii đc,4
tạm được,4
hàng đẹp,4
tuyệt,4
làm_ơn bỏ giùm cái thông_báo ưu_đãi kiểu đang giao đơn được không không đặt_hàng mà thông_báo kiểu này nhìn hết_hồn thật_sự,4
lúc trc e mua món đó phí ship 11k bây h tăng lên thành 20 ngàn là s,4
hiểu sao lazada hơn 100tr tải còn shopee chỉ hơn 50tr hàng_hóa thì hên xui có này có kia nhưng chăm_sóc khách_hàng thì shopee thua xa lazada shipper shopee mình nhắn_tin gọi để xin giao lại hàng vào thời_điểm mình có_thể nhận đc mà nhắn ko trả_lời gọi mấy cuộc ko nghe rồi thêm quả khách chưa kịp nói xong tắt luôn máy lazada có shipper cố_định tùy khu_vực mà tinh_tế cực shopee nhiều ông mà gặp mấy ông chảnh tự_hủy hàng của khách không nghe điện_thoại khách luôn review chân_thực_á,4
hàng_hóa cái gì cũng đắt mà tôi thích coi cho 4 sao là đủ rồi,4
nen giam ship đe_dc mua hàng nhieu hon đoi khi muon mua nhung ship cao chán k muon mua nua,4
đặt_hàng cũng được nhưng lâu về nên cho 4sao thui,4
không còn sử_dụng tính_năng áp cùng lúc mgg hoàn tiền,4
mat hàng mua ko đc đổi trả ko đc kiểm_tra hàng cho 4s,4
lazada mik mua dùng ko đc nhiều xu như shopee,4
ok có box ích này a,4
chưa hài_lòng tuyệt_đối,4
giao hàng nhanh tốt,4
llkoll lo lllool l,4
cũng tạm được thôi,4
giao hang dung ngày,4
chưa nhan chưa bt,4
k tốt lắm,4
rất hài_lòng,4
10đ,4
miou,4
on,4
cũng tốt,4
oke tốt,4
ủa chơi ấn vào nó hiện lên rồi tự_nhiên mất kết_nối_mạng là sao rồi nó cũng mất hết cái như xu hay năng_lượng rồi nó cũng gần hết nhiên_liệu là sao mua cái rương xanh là 3000 xu lận zalada đã ăn chặng xu kiếm được từ mấy tháng trước của tôi đang tích_lũy à cái này nhiều lần lắm rồi nên mới nói dù gì người xài ápp này cũng kiên_trì để vô nhận xu để tiết_kiệm tiền chứ đâu phải để chơi đâu mong xem_lại trò_chơi để lấy xu merge boss cảm_ơn vì đọc cái lời nhận_xét của tôi,4
rrat ok va giao hàng nhanh va có rat nhieu ma giảm_giá ad,4
chưa hài_lòng lắm có lần đặt_hàng mà shop gửi không đúng hàng yêu_cầu,4
mong lazada có_thể đưa ra nhiều sản_phẩm hơn nữa,4
đặt 3shop hết hàng cả 3 xem_lại đi ad nản,4
cũng được nhưng mà không nhiều mặt_hàng cho lắm,4
một_số mặt_hàng đặt không đúng hẹn trả,4
giao hàng còn chậm quá,4
rất tốt nhưng tiền sphi đắt quá,4
chưa bt,4
nhanh,4
còn tồn_tại nhiều shop không gởi_hóa_đơn không biết đc đt liên_lạc làm khách_hàng thiếu an_tâm đặt_hàng,4
hết dám đặt_hàng của lazada nhân_viên giao hàng ở ngã bảy hậu giang gian_lận tiền_bạc với khách_hàng,4
không có chính_sách bảo_vệ người mua hàng app rất nặng tự_ý hủy_đơn đứng về phía người bán ép người mua_hủy_đơn không có quy_trình đổi hàng mà buộc trả hàng nên mất toàn_bộ ưu_đãi đã áp_dụng hoàn tiền khi hủy_đơn được thực_hiện rất lâu có đổi giao_diện như shopee cũng không_thể_nào được như shopee về mặt cskh 7 12 23 ui và ux tốt hơn rất nhiều,4
mình đặt mấy cái giao 24 giờ thì toàn là giao lâu hơn dự_kiến nên cho 4 sao thôi nhé,4
nhanh gọn có nhiều khi tìm_kiếm cứ lung_tung,4
mong app sẽ có nhiều mẫu_mã đa_dạng cho những cây_bút mực tím ạ,4
lazada san pham đa_dạng thời_gian giao hàng quốc_tế khá nhanh,4
ổn nhưng chưa sàng_lọc nhà cung_cấp kĩ,4
lazada cập_nhật thêm khu vưc nhận gạo đi ạ,4
khá là ok nói_chung là ổn hơn shopee,4
đtdđ ư look là za có 00zppppb cho mọi,4
ok ứng_dụng bán hàng tốt,4
nhiều vấn_đề về giao hàng,4
giá tốt uy_tín,4
ok nhưng đồ thì đắt xíu,4
chưa dùng thử để shop 4 sao tạm,4
chưa nhận được hàng nên chưa biết chất_lượng,4
ko thể nhập địa_chỉ,4
tốt nhưng giá hơi cao,4
rất tốt hơn shoppi,4
thì ok thoi,4
